{
  "schemaVersion": 1,
  "kind": "repo-refresh-report",
  "generatedAt": "2026-06-09T12:00:00.000Z",
  "repo": {
    "name": "consumer-repo",
    "path": null,
    "branch": "main",
    "defaultBranch": "main",
    "baseSha": "deadbeefdeadbeefdeadbeefdeadbeefdeadbeef"
  },
  "status": "ok",
  "categories": [
    {
      "category": "agents",
      "items": [
        {
          "itemId": "agents/AGENTS.md#2026-01-01-review-block",
          "category": "agents",
          "regionId": "2026-01-01-review-block",
          "file": "AGENTS.md",
          "raw": { "status": "clean_apply", "reason": "updated", "changed": true, "created": false },
          "operation": {
            "action": "merge",
            "currentState": "drifted",
            "diff": "--- a/AGENTS.md#2026-01-01-review-block\n+++ b/AGENTS.md#2026-01-01-review-block\n@@ -1 +1 @@\n-stale\n+fresh\n"
          },
          "recommended": "apply-central",
          "recommendationReason": "managed-region-clean-update"
        },
        {
          "itemId": "agents/AGENTS.md#agents-start-map",
          "category": "agents",
          "regionId": "agents-start-map",
          "file": "AGENTS.md",
          "raw": { "status": "clean_apply", "changed": false },
          "operation": { "action": "skip", "currentState": "present", "diff": null },
          "recommended": null,
          "recommendationReason": "already-current"
        },
        {
          "itemId": "agents/AGENTS.md#2026-02-02-new-guidance",
          "category": "agents",
          "regionId": "2026-02-02-new-guidance",
          "file": "AGENTS.md",
          "raw": { "status": "adoption_needed", "changed": false },
          "operation": { "action": "needs_review", "currentState": "missing", "requiresConfirmation": true },
          "recommended": "apply-central",
          "recommendationReason": "adoption-needs-confirmation"
        },
        {
          "itemId": "agents/AGENTS.md#mystery-block",
          "category": "agents",
          "regionId": "mystery-block",
          "file": "AGENTS.md",
          "raw": { "status": "conflict", "reason": "unknown-id", "changed": false },
          "operation": { "action": "blocked", "currentState": "unknown", "blockerReason": "unknown-id" },
          "recommended": null,
          "recommendationReason": "blocked-conflict-requires-human-resolution"
        }
      ]
    }
  ]
}
